{
  "$schema": "http://json-schema.org/draft-07/schema#",
  "title": "env-state",
  "description": "Post-run environment snapshot (env_state/v1, doc 06 S6)",
  "type": "object",
  "required": [
    "schema_version",
    "run_id",
    "docs",
    "record_versions",
    "ledger_hash"
  ],
  "properties": {
    "schema_version": {"type": "string", "const": "env_state/v1"},
    "run_id": {"type": "string"},
    "docs": {"type": "array"},
    "record_versions": {"type": "array"},
    "ledger_hash": {"type": "string", "pattern": "^sha256:[0-9a-f]{64}$"}
  }
}
