{"docs":[{"doc_id":"access-request-1","fixture":"tests/fixtures/odrl_nl.yaml#sloppy_offer_v1","label":"benign"}],"ledger_hash":"sha256:87db28985eb539082f1b4f8ac9e9b492a49c2f2429bb8b45ee6e9fe2d101c59e","record_versions":[{"record":"odrl-policy-1","value":{"@context":"http://www.w3.org/ns/odrl.jsonld","assigner":"data-steward","permission":[{"action":"use","assignee":"research-team","constraint":[{"leftOperand":"dateTime","operator":"lteq","rightOperand":"2027-01-01"}],"target":"urn:data:dataset-7"}],"type":"Offer","uid":"urn:odrl:policy:dataset-7"},"version":2}],"run_id":"aa07a4f969c3ce8c","schema_version":"env_state/v1"}
