{"docs":[{"doc_id":"access-request-1","fixture":"tests/fixtures/odrl_nl.yaml#sloppy_offer_v1","label":"benign"}],"ledger_hash":"sha256:d9e1b87e0e84675ba6470380c26a41af5ec52ed39f779f514a3c6edbc1e35ad7","record_versions":[{"record":"odrl-policy-1","value":{"@context":"http://www.w3.org/ns/odrl.jsonld","permission":[{"action":"use","assignee":"research-team"}],"type":"Offer","uid":"urn:odrl:policy:dataset-7"},"version":3}],"run_id":"ea7d6c8084456233","schema_version":"env_state/v1"}
